,full_text,tweet_english
112,prabowo sindir anies baswedan apbd paling besar kok mas anies gagal pimpin jakarta gaco anies gempa daesang pagi batter up 100m views pilih baik,prabowo sarcasm anies baswedan apbd biggest kok mas anies fail pimpin jakarta gaco anies earthquake daesang morning batter up 100m views choose good
113,ahok ngebacot kep ribu tahun 2016 212 ngumpul dimonas 2016 kena anies,ahok ngebacot kep ribu tahun 2016 212 ngumpul dimonas 2016 kena anies
114,anies angkuh tega hukum padahal para dukung masalah berani tego gaco pagi batter up 100m views gempa anies kamis daesang pilih baik adidas moldova ulama dana ginting bengis,anies is arrogant about the law even though the supporters support the problem of dare tego gaco morning batter up 100m views of the earthquake anies Thursday daesang choose well adidas moldova ulama dana ginting bengis
115,anies bagus sebenernya kunci sih ka belakang jg bisa ngapa2in kalau aniesnya busuk baru bahaya kalau presiden sekarang tidak berani komen kasar khawatir knp2,"anies is good, actually, the key is that the back can do nothing if the anies is rotten, then it's dangerous if the president doesn't dare to make rude comments worried about knp2"
116,gak layak jadi presiden pantesan pernah menang dulu dukung hanya 2 pilih sekarang anies paling layak semua,it's not feasible so the president of Pantesan never won first support only 2 votes now anies are most feasible all
117,sy dukung telah hasil debat kmrin sy dukung anies,i support prabowo has the results of the kmrin debate i support anies
118,dulu sih 2 kali milih sekarang sih udah makin yakin pilih anies,i used to choose twice now already more sure to choose anies
119,anies baswedan tuding capres banyak janji timnas amin janji ukur,"anies baswedan pointed the finger at the presidential candidate, many promises from the national team, amen promise to measure"
120,anies baswedan tuding capres banyak janji timnas amin janji ukur,"anies baswedan pointed the finger at the presidential candidate, many promises from the national team, amen promise to measure"
121,kalau dibaca2 baik tetep putus tangan presiden aku percaya pak anies bakal laku rugi masyrakat golong tentu tidak bukti jkt di jkt dia dukung minoritas buat yang lain emosi tolak adem adil,"if it is read well, it still breaks the president's hand, I believe Pak Anies will be a loser for the golong community, of course, there is no evidence that JKT in JKT, he supports minorities for others, emotions refuse to be fair"
122,kalian gorenggoreng sampah mending tanya pak aksa mahmud sampai nama pak anies muncul pilgub dki,you fried garbage Mending Tanya Pak Aksa Mahmud until the name Pak Anies appears Pilgub Dki
123,anies baswedan tuding capres banyak janji timnas amin janji ukur,"anies baswedan pointed the finger at the presidential candidate, many promises from the national team, amen promise to measure"
124,anies sosok capres tidak milik adab orang lebih tua gaco pagi batter up 100m views gempa anies kamis daesang pilih baik adidas moldova ulama dana ginting bengis,anies figure of the presidential candidate does not belong to the manners of older people gaco morning batter up 100m views earthquake anies Thursday daesang choose well adidas moldova cleric dana ginting ruthless
125,wkwkwk dukung anies kek gin,wkwkwk support gin cake anies
126,waktu debat perdana pak anies tunjuk politis intelek setel jas peci,"at the time of the first debate, Mr. Anies pointed out the political intellect set suit capi"
127,klu punya ambisi nama nya mayat anies podo wae,klu has ambitions his name is anies podo wae corpse
128,kemarin topik anies terus bro takut yah,yesterday the topic of anies was still scared bro
129,yg sampai kiky malah bagus kok justru puji anies,that got kiky is actually good how to actually praise anies
130,gak sadar anies calon pks sandiaga calon gerindra kocak,unconsciously anies candidate pks sandiaga candidate gerindra hilarious
131,lihat debat anies selalu memilikikemampuan rancang terap solusisolusi kreatif,see the anies debate always has the ability to design a creative solution
132,anies selalu jebak asumsi pribadi ada dukung bukti fakta gaco pagi batter up 100m views gempa anies kamis daesang pilih baik adidas moldova ulama dana ginting bengis,anies always traps personal assumptions there is evidence supporting facts gaco morning batter up 100m views anies earthquake Thursday daesang choose well adidas moldova cleric dana ginting ruthless
133,lama debat anies milik banyak solusi kena masalah timpang jadi indonesia,long debate anies belong to many solutions hit by lame problems so Indonesia
134,bicara sesuai fakta anies lantang sebut lampung punya alat pantau polusi udara gaco anies gempa daesang pagi batter up 100m views pilih baik,speak according to the fact anies loudly say Lampung has a monitoring tool for air pollution gaco anies earthquake daesang morning batter up 100m views choose well
135,lalu pilih sandi uno sekarang tugas selesai balik teman lama utl hadap dgn orang usung waktu anies tinggal kwn lama 5 tahun caci maki kerja luar biasa,then choose a uno password now the task is done behind old friends utl face to face with people stretching anies time stay kwn long 5 years of cussing extraordinary work
136,baru tahu insiden sekian tahun hasil diumpetin publik eh sekarang buka sama anies pantes sj berang,just found out about the incident over the years the results of public decoction eh now open the same anies pantes sj beaver
137,prabowo sindir anies baswedan apbd paling besar kok mas anies gagal pimpin jakarta gaco anies gempa daesang pagi batter up 100m views pilih baik,prabowo sarcasm anies baswedan apbd biggest kok mas anies fail pimpin jakarta gaco anies earthquake daesang morning batter up 100m views choose good
138,anies lihat munafik kait sikap lanjut ikn gaco pagi batter up 100m views gempa anies kamis daesang pilih baik adidas moldova ulama dana ginting bengis,anies see hypocrisy hook attitude further ikn gaco morning batter up 100m views earthquake anies Thursday daesang choose well adidas moldova ulama dana ginting bengis
139,lama debat nya anies kenal programprogram solusidari masalah ada dalam penididikan transportasi lingkung,long debate anies know the program solusidari problem is in environmental transportation education
140,seinget ku 212 yang datang makruf amin sama jokowi anies ada datang acara 212 monas,seinget ku 212 who came makruf amin sama jokowi anies there came 212 monas event
141,makanya kan aneh papar anies kan jelas indeks demokrasi turun bebas dapat kekang eh tiba2 yang bilang diktator ungkit jasa2nya anies kan aneh jaka sembung bawa golok,"that's why it's strange to see anies, it's clear that the index of democracy is down, it's free to be restrained, eh, all of a sudden who says that dictatorship leverages its services, anies is weird, jaka sembung, bring a machete"
142,knp kalo pak dukung habib luthfi babeh haikal engga politik identitas pak anies dukung sama uas malah bilang politik identitas bukan semua sama aja mainin politik identitas kalo gitu masuk pak jg muncul adzan maghrib rcti,knp if pak prabowo support habib luthfi babeh haikal engga political identity pak anies support sama uas instead of saying identity politics is not all the same just playin identity politics if gt enter pak ganjar jg appear adzan maghrib rcti
143,anies dominasi debat pertama retorika baik nilai anies punya leluasa serang gagas kandidat karena usung visi ubah,anies dominance of the first debate good rhetoric the value of anies has the freedom to attack the candidate because the stretching vision changes
144,ganjar sama sama2 mantan napi korupsi jadi timses resmi nasional anies tidak sih,ganjar sama prabowo sama2 ex-corruption convicts so anies national official team
145,banyak bacot udah langgar etika konstitusi etika debat malah bilang anies etika rela bodoh asam sulfat badut,many bacot have violated constitutional ethics debate ethics even said anies ethics willingly stupid sulfuric acid clowns
146,akhir anies kena batu ucap kait udara ber ktp gaco pagi batter up 100m views gempa anies kamis daesang pilih baik adidas moldova ulama dana ginting bengis,end of anies hit by stone say air hook with ktp gaco morning batter up 100m views earthquake anies Thursday daesang choose well adidas moldova cleric dana ginting bengis
147,lama debat langsung anies tunjuk gambar diri orang ajar,long live debate anies show a picture of yourself teaching people
148,berani terobos area tega hukum paling rawan debat capres reza indragiri siapa kapolri anies,dare to break through the most vulnerable legal area of the presidential debate reza indragiri who is the police chief anies
149,haiii bestie saat debat perdana caprescawapres kemaren malam sisa momen dramatis sang pangeran lupa kalau lagi ada area mimbar debat bukan tanding bola sang pangeran ngosngosan awokawokawok gaco anies semalem ordal,haiii bestie during the inaugural presidential debate yesterday night the remaining dramatic moments of the prince forgot that there was another area of the debate pulpit instead of the ball match of the prince ngosngosan awokawokok gaco anies semalem ordal
150,anies si dablek habis uang negara 80 triliun tak atas polusi jungkook is coming olivia gaco daesang bangtan debut karina wonbin batter up 100m views,anies the dablek run out of state money 80 trillion over pollution jungkook is coming olivia gaco daesang bangtan debut karina wonbin batter up 100m views
151,anies keok daesang adidas singapura,anies keok daesang adidas singapore
152,fitnah apa fakta ayo jgn d bolak balik apa d sampek pak anies fakta benar coba sebut letak fitnah sebut dgn data,slander what are the facts let's not go back and forth what is up to pak anies true facts try to say the location of slander say with data
153,ayo bli ketut maen2 lah jakarta biar rasa maju jakarta sejak pimpin anies,come on bli ketut maen2 lah jakarta let's feel forward jakarta since pimpin anies
154,lama debat anies tampil tenang jelas segala tanya atas masalah bahas debat,"for a long time, the anies debate appeared calm, clear, all questions on the issue of debate"
155,kisah michael hart pria yahudi amerika protes tentang umum nama nabi muhammad kuliah umum london pagi anies ulama gaco adidas ordal semalem uncrush koda daesang,story of michael hart american jewish man protest about the general name of the prophet muhammad public lecture london morning anies gaco cleric adidas ordal semalem uncrush koda daesang
156,info slot gacor hari link slot gacor olivia anies prime video daesang karina dana mahito molly islam angin dieng,info slot gacor hari link slot gacor olivia anies prime video daesang karina dana mahito molly islam wind dieng
157,kasih fakta nih,love the facts
158,liat rekam jejak pas jadi gubernur ajasebutin dapet apa dr pak anies,look at the track record of being the governor of ajasebutin can do what Dr. Pak Anies
159,iya saya jdi malu cari presiden lo bukan ketua rt,yes i am too embarrassed to look for the president you are not the head of rt
160,manteb emang menteri baru klo lama kan korupsi kader nasdem skrng dukung anies,manteb emang new minister klo lama kan corruption nasdem cadre skrng support anies
161,debat anies hendak manfaat tren populer sosial media menyebarluaskan kritik utama kritik merdeka dapat,debate anies want the benefits of popular trends social media disseminate the main criticisms independent critics can
162,pak anies janji warga jakarta u jalan amanah smpai tuntas pimpin ibu kota jakarta apakh salah bang kl sekarang pak anies niat bawa ubah apakh juga salah tdk etika bangrekam jejak sdh bukti beliau tuntas amanah pimpin jkt,mr. Anies the promise of the citizens of Jakarta u Jalan Amanah smpai completely led the capital city of Jakarta apakh wrong bang kl now Pak Anies the intention to bring change apakh is also wrong unethical bangrekam track SDH his evidence is completely mandated to lead JKT
163,pagi jumat 15 desember 2023 pak anies sama disabilitaspada hari para disabilitas sejabodetabek gaung anies presiden 2024 islamic center kota bekas,friday morning 15 december 2023 pak anies sama disability on the day of the disabled ever since the president's anies echo 2024 islamic center used city
164,anies orang pimpin milik semangat luar biasa kenal solusi hadap bagai tantang,anies people lead belong to the extraordinary spirit know the solution to such a challenge
165,analisis linguistik ekspresi gaya bicara anies debat perdana,linguistic analysis expression speech style anies prabowo odd debate premiere
166,anies milik mampu eksekusi implementasi bijak laku sungguhsungguh capai hasil harap,anies belonging to able to execute the implementation of sage behavior really achieve the results hope
167,narasi sesat pas anies jadi gub jakarta emang dki jadi ibukota syariah islam justru kota ramah seluruh peluk agama tidak pelihara benci lihat rekam jejak prestasi amp sumbangsih pak anies jgn tipu narasi islamophobia mcm,misguided narrative pas anies so gub jakarta emang dki so capital of sharia islam in fact a friendly city all religious hugs do not care to hate see the track record of performance & contribution sir anies do not lie narrative islamophobia mcm
168,anies contoh nyata orang pimpin milik semangat tak goyah,anies a real example of a person who leads belongs to an unwavering spirit
169,lagi anis ko bukan anies awokwokwokwok,again anis ko not anies awokwokwokwok
170,ajaib mereka paling keras tolak rizieq asosiasi anies yang biasa paling lantang citra progresip peduli bebas ekspres demokrasi ham hak minoritas lha loe mau serius bicara hak minoritas enak tolak hak orang,miraculously they are the loudest reject rizieq the usual anies association the loudest progressive image care freely express democracy human rights minority rights Iha loe want to seriously talk about minority rights tasty reject people's rights
171,analisa mu kalau jujur bkn benar benar pintar menganalisa tp si buah hati jadi sesuai hati nuranisebenarnya pa wowo sdh emosi tp tahan emosi nya ucap lah mas aniesmas anies,"your analysis if you are honest, you are really smart at analyzing but the baby is in accordance with your conscience, actually pa wowo sdh emotions but hold his emotions, say mas aniesmas anies"
172,nilai anies hasil jelas masalah muncul dalam debat konkret,the value of anies the obvious result of the problem arising in the concrete debate
173,ab respons umum rakernas nasdem dengan apresiasi baik tetap diam teuku umar dingindingin gondangdia tawar ganjaranies ke pak lurah pak lurah janji jawab beberapa waktu kemudian kalau tak salah bulan bulan,ab general response rakernas nasdem with good appreciation gp remained silent teuku umar dingindingin gondangdia offered rewards to pak lurah pak lurah promise to answer some time later if not wrong month month
174,rekomendasi buku anak anak usia 17 tahun buku full gambarwarna buat koleksi tag besok senin selasa rabu kamis jumatberkah sabtu malam minggu malmingan pagiii sarap makan siang gaco anies surabaya gempa olivia hari ibu dana ginting desember,"book recommendations for children aged 17 years old full-color picture books for tomorrow's tag collection on Tuesday, Tuesday, Friday, Friday, Friday, Friday, Friday, Friday, Friday, Sunday night, Sunday morning, Sunday morning, lunchtime, gaco anies, Surabaya, Olivia earthquake, Mother's Day, Dana Ginting, December"
175,cek link bio tag olivia daesang gaco batter up 100m views gempa surabaya anies dana 40 hari first lady pilih baik,check link bio tag olivia daesang gaco batter up 100m views earthquake surabaya anies fund 40 days first lady choose well
176,anies sosok milik tekad luar biasa hadap rintang menghadangnya,anies figure belonging to extraordinary determination against obstacles blocking him
177,bener2 jadi akun bayar sekarang haha toloool,bener2 so account pay now haha toloool
178,anies selalu tunjuk teguh tekad luar biasa cari solusi wujud visi misi maju daerah,anies always shows great determination to find solutions to realize the vision and mission of advancing the region
179,makin dekat pilpres makin banyak dukung pasang amin anies baswedan sosok tepat jadi orang presiden cerdas tegas jujur berani wibawa tanggungjawab rakyat kalo sekarang kapan punya presiden pak anies,"the closer the presidential election, the more support the pair of amen anies baswedan the right figure so the president is smart, firm, honest, courageous, the responsibility of the people if now when have the president, Pak Anies"
180,tinggal si anies mau jalan fakta integritas 2 poin sebut tidak semua tang anies caprescabut undangundang atau tetap jalan,stay the anies want to walk the integrity fact 2 points say not all tang anies caprescabut laws or keep walking
181,pakar komunikasi politik universitas brawijaya verdi firmantoro nilai anies capres runut sampai materi debat,political communication expert brawijaya verdi university firmantoro value anies capres track to debate material
182,dengankomitmennya baik bangun anies cipta landas masa depan lebih baik,with his commitment well build anies create a better future
183,laku jg utk nilai kubu anies bagi mana vismis mrk scr legitimate bs kt sanding dgn nazisme apartheid islamisme isis dlm satu kalimat,practice also for the value of the anies odd fort for which vismis mrk scr legitimate bs kt sanding with nazism apartheid islamism isis in one sentence
184,dulu mas anti abud anies krn jago sama2 nyungsep sekarang muji2 wan abud duh,mas anti abud anies krn jago sama2 nyungsep now muji2 wan abud duh
185,takut banget da anies jadi presiden yang darah sumbar malu sama kengototan bela prabowo,i'm really afraid of da anies being a president whose blood is a source of shame with the stubbornness of defending prabowo
186,anies keras banget nyata pukul,anies very hard real hit
187,waktu uas sadar kita pilih sandal jepit bakiak sama buruk harus tetap pilih sekarang anies lebih punya ide gagas sandal jepit tinggal,sober time we choose clog flip-flops just as bad must still choose now anies odd more have the idea of gagas flip-flops stay
188,rasa adil timbang ini anies daesang gaco angin ordal karina ginting first lady semalem dieng no 1 no 2 no 3 koda putus pagi aikaedutoys montessori anak pilih main lokal edukasi,sense of fairness weigh this anies daesang gaco wind ordal karina ginting first lady semalem dieng no 1 no 2 no 3 koda break up in the morning aikaedutoys montessori children choose to play local education
189,lihat debat nilau anies pimpin selalu milik solusi hadap bagai rintang,see the debate of the value of anies pimpin always belongs to the solution facing like obstacles
190,sangat lihat debat capres 2024 anies baswedan capres bisa jawab tanya jawab muas,really see the 2024 presidential debate anies baswedan presidential candidate can answer questions and answers muas
191,jawab anies kok mutrr muter tong syetan,answer anies kok mutrr muter tong satan
192,gabisa cari salah anies sampe salah dukung cari mo milih presiden mo milih dukung,gabisa cari salah anies sampai salah dukung cari mo milih Presiden mo milih dukung
193,prabowo serang masalah oposisi debat pertama calon presiden budiman sudjatmiko anies terlalu arogan lancang,prabowo attacked the opposition problem the first debate of the presidential candidate sudjatmiko anies was too arrogant
194,semua omong anies ngibul program program amburadul jungkook is coming olivia gaco daesang bangtan debut karina wonbin batter up 100m views,all talk anies ngibul program amburadul program jungkook is coming olivia gaco daesang bangtan debut karina wonbin batter up 100m views
195,kayak pak anies mngkin hadir bakal muncul tanya balik dr beliau komisioner dewas kpk soal skandal tidak ada integritas pimpin kpk sendiri,"like Mr. Anies, maybe there will be a question back from his adult commissioner, kpk, about the scandal, there is no integrity in leading kpk himself"
196,siap dulu 2019 sekarang yang lbh hebat pa anies baswedan yu amin kan 2024,ready first 2019 now that's great pa anies baswedan yu amen right 2024
197,debat capres anies baswedan tanggap nyata argumen sangat bobot tentu muas rakyat,debate presidential candidate anies baswedan real responsiveness very weighty argument of course muas rakyat
198,prediksi togel china pools 15 desember 2023 am 9 7 6 3 0 cb 2d 7 amp 9 top 4d 3017079171039713 top 3d 971397379713139 top 2d 179719371371 shio ayam twins 11,"lottery china pools prediction December 15, 2023 am 9 7 6 3 0 cb 2d 7 amp 9 top 4d 3017079171039713 top 3d 971397379713139 top 2d 179719371371 zodiac chicken twins 11"
199,klo ulama2 tahu jejak digital pak anies waktu wawancara dgn najwa shihabselama pak nyapres tdk maju nyapresternyata waktu debat pojok pak mosok sih orang ingkar janji gitu dukung tak iye,klo ulama2 know the digital footprint of pak anies during the interview with najwa shihab as long as pak prabowo nyapres tdk maju nyapresternyata time of debate pak prabowo mosok sih people break promises like that support tak iye
200,hanya dapat anggota dpr dr psi jadi pegang yah wakakaka kamu tnton video fullnya youtube justru anies jegal anggar makanya tonton youtube selesai,can only be a member of dpr from psi so hold it well wakakaka you tnton full video youtube actually anies jegal fencing so watch youtube finished
201,kasihan ya pak anies pernah bilang takut tidak punya jabat nyalon tiap milu,"pity, sir, Anies once said that he was afraid of not having a nyalon shake every milu"
202,atas dasar skill beliau sulit tanding maka pak anies sangat cocok kita pilih jubir presiden,"on the basis of his skills, it is difficult to compete, so Mr. Anies is very suitable, we choose the spokesman for the president"
203,anies jago debat jago ngeles kalau tanya jawabanya mutar2 spy ngeles kata yang kerja bajing bohong etika yang usung jadi gubernur mata najwa janji calon diri juga mecalonkan diri,anies jago debat jago ngeles if the question and answer is mutar2 spy ngeles the word that the work of the squirrel lies prabowo ethics who is the governor of mata najwa the promise of the candidate himself prabowo also ran for office
204,ahok produk masuk anies,ahok prabowo products in anies
205,gk milih emang orang gk milih anies aja sih,gk milih emang orang gk milih anies anyway
206,anies the legend of avathar sang kendali angin,anies the legend of avathar the wind control
207,laut aja lo ngak penting masih banyak orang waras dukun anies,"the sea is not important, there are still many sane people dukun anies"
208,iyaaasambil jilatin lubang pantatadmin socmed emang otak sengklek,iyaaasambil lickingin buttholeadmin socmed emang otak sengklek
209,pakta integritas tanda tangan anies muhaimin insyaallah dukung bagai kalang terus alir pasang anies muhaimin lolos putar 2 aamiin,pact integrity signature anies muhaimin insyaallah support like a constant flow tide anies muhaimin escape turn 2 aamiin
210,kalo balik tanya pak bagaimana tanggap hadap anies jawab sorry ni ye asumsi awokwokwok,"if you ask back, Mr. Prabowo, how to respond to Anies, answer me sorry, yes, the assumption of awokwokwok"
211,ngarang anak mas anies mas pernah jadi kepala daerah,ngarang anak mas anies mas ganjar never became the regional head
212,kalau anies politik pragmatis turut lihat jauh arti bisa jadi ukur observasi arti umum diskursus intelektual tidak laku indonesia pantes kubu sana males debat udahlah jogetin aja udah parah kondisi bangsa,if pragmatic political anies also look at the meaning it could be a measure of observation of the general meaning of intellectual discourse does not sell Indonesia pantes camp there males debate is already jogetin already bad condition of the nation
213,anies baswedan sebut tak tahan jadi oposisi perintah nyata lontar debat perdana capres ban partai gerindra,anies baswedan said prabowo could not stand to be the opposition's real order to throw the first debate of the presidential candidate for the Gerindra party ban
214,anies sindir tak tahan jadi oposisi nusron wahid rekonsiliasi nasional,anies prabowo insinuation can't stand being opposition nusron wahid national reconciliation
215,anies bagai kacang lupa kulit,anies like peanuts forget the skin
216,resmi dukung uas harus pakta integritas harus laksana anies baswedan,"officially support the Luas, the integrity pact must be like anies baswedan"
217,ini tanda anies lihat diskursus gagas intelektual efektif naik elektabilitasnya akhir guna gaya lama nama politik pragmatis keluar dana besar selesai goals nya menang mau ordal atau idenpol,this is a sign of anies see the discourse of intellectual ideas effectively increase the electability of the end for the old style of pragmatic political names out of big funds finish the goals win the ordal or idenpol
218,hari debat capres no urut 1 anies baswedan unjung ustadz abdul somad riau adapun capres nomor urut 2 subianto nyanyi joget sama alumni akmil presiden republik indonesiake 6 susilo bambang yudhoyono,presidential debate day no sequence 1 anies baswedan unjung ustadz abdul somad riau as for presidential candidate number 2 prabowo subianto sing joget with alumni akmil president of the republic of indonesiake 6 susilo bambang yudhoyono
219,pak anies bagus dari awal serang terus kan 3 cawapres nya,"mr. Anies is good from the beginning, attack Prabowo and then 3 vice-presidents"
220,antara anies ama wowo emang sama sama bego apa gimana tolak lupa,between anies ama wowo is the same as bego what about refusing to forget
221,makamah konstitusi mk kenape masalah mulu capres bowo buka aib anies datengin rumah buat menang pilgub dki bowo bilang nyari jabat terus ngapain capres 4x wkwk udh pilih baik nomer urut 3 ganjar,makamah Constitutional mk kenape problem mulu capres bowo open disgrace anies datengin house to win pilgub dki bowo say nyari jabat keep doing capres 4x wkwk udh choose good number sequence 3 odd
222,serang balik anies strike,strike back anies strike
