,full_text,tweet_english
223,anies pernah culik kok tuduh jahat kocak,anies once kidnapped why do you accuse me of being nasty hilarious
224,biasaa semua krn bakar jenggot sampe takut tengah mati brarti gadukung anies sampe fitnah caci maki ulama astaghfirullah inget azab byk2 istighfar mending,usual all because burn the beard until the fear of dying brarti gadukung anies until the slander of insulting the cleric astaghfirullah remembering the punishment byk2 istighfar mending
225,abraham samad gugat pilih jadi presiden kelleher olivia anies adidas daesang gaco surabaya pagi gempa ginting dana brighton moldova molly pilih baik first lady,abraham samad lawsuit prabowo choose to be president kelleher olivia anies adidas daesang gaco surabaya morning earthquake ginting dana brighton moldova molly choose either first lady
226,mulai laku 1nt1m1d4si,from 1nt1m1d4si
227,biasaaa buzzer mahh kalo nemu lemah anies akhir bikin2 hasut kalo engga tidak makan,biasaaa buzzer mahh if you find weak anies at the end make you instigate if you don't eat
228,sempat diskus para pemuda jambi milik semangat ubah indonesia diskusi mulai soal didik konflik agraria teknologi aman data hingga bijak bangun akan ambil pilih jadi presiden,"had time to discus the youth of Jambi belonging to the spirit of changing Indonesia, discussions began about the education of agrarian conflicts, data-safe technology, so that wise wake up will choose to be president"
229,ibarat tanding sepak bola suporter kalah kecewangomel bahagia cari cari salah musuh yang alami kubu dukung team anies yng bahagia ini,is like a football match the supporters lose kecewangomel happy find one of the enemies who are natural fort prabowo ganjar support this happy anies team
230,genuinely nanya misal aku pilih anies muhaimin tp aku pilih legislatif pks nasdem nya contoh pks ruu nya problematik gitu gimana,genuinely ask for example I choose anies muhaimin but I choose the legislature pks nasdem his example pks ruu his problematic like that
231,anies level ketua demo protes terus tp ngerti mssalah,anies level the leader of the protest demonstration continues to understand mssalah
232,wow ini benar,wow this is true
233,jelas tak level laaah mbak pak anies tuuuh capres bang fahri cuman juru bicara kl buat tweet tuuuh pak baru tuuuh level dgn pak aniessama2 capres cerdas dikit berhusnudzon napa siih mbak kata nya pilpres gembiralupa yaa gemoy,clearly not level laaah mbak pak anies tuuuh capres bang fahri cuman kl spokesman for tweet tuuuh pak prabowo baru tuuuh level with pak aniessama2 capres intelligently little nusudzon napa siih mbak kata nya pilpres gembiralupa yaa gemoy
234,amin doa khusus hari jumat segala hajat kabul gaco daesang semalem surabaya ordal anies adidas karina koda,amen special prayer friday all wishes kabul gaco daesang semalem surabaya ordal anies adidas karina koda
235,anies angkuh tega hukum padahal para dukung masalah berani tego gaco olivia jill biden daesang gempa adidas surabaya batter up 100m views pilih baik melania bangtan debut,anies arrogant tega law even though the supporters support the problem of dare tego gaco olivia jill biden daesang earthquake adidas surabaya batter up 100m views choose well melania bangtan debut
236,w45it jangan ikut main,w45it don't play
237,mmmmkayaknya ngga yakin nih sama kualitas capres dukung butuh bawa2 nama orang delusi anda lebih baik anies wake up bro ikhlas hati baik indonesia seluruh biar baik yang pilih,"mmmm, I guess I'm not sure about the quality of the presidential candidate supporting the need to bring the names of your delusional people better anies wake up bro sincerely good hearted Indonesia throughout so that both choose"
238,anies sosok capres tidak milik adab orang lebih tua gaco olivia jill biden daesang gempa adidas surabaya batter up 100m views pilih baik melania bangtan debut,anies figure of the presidential candidate does not belong to the manners of older people gaco olivia jill biden daesang earthquake adidas surabaya batter up 100m views choose well melania bangtan debut
239,kalau dibaca2 baik tetep putus tangan presiden aku percaya pak anies bakal laku rugi masyrakat golong tentu tidak bukti jkt di jkt dia dukung minoritas buat yang lain emosi tolak adem fakta,"if it is read well, it still breaks the president's hand, I believe Pak Anies will be a loser for the golong community, of course not proof of JKT in JKT, he supports minorities for others, emotions reject adem facts"
240,macam serang anies lalu anies nampol balik woiii,like attack prabowo anies then anies nampol back prabowo woiii
241,andai partai gabung anies kicau seperti juga sakit hati tinggal,if the party joined the chirping anies as well as the heartache of staying
242,jadi anggota mrk yang bunuh kan 6 orang udah bunuh dapet jabat anies nolong klo mrk mau nyoblos dukung cm hak warga negara mau golput jg hak mrk lama mrk bukan genocide supporters or genocide actors kasih jabat mrk tidak bsa buat ap2,being a member of MRK who killed 6 people already killed get a job anies nolong klo mrk want nyoblos support cm citizen rights want golput jg rights mrk lama mrk not genocide supporters or genocide actors love shake mrk not bsa for ap2
243,klo mau debat ini panjang akhir lu nyalahin karna lu dukung anies masalah tega hukum semraut saya apresiasi koq nyata anies klo tegak hukum masih kacau arah kan bukan kesana,if you want this debate to be long at the end you are guilty of prabowo because you support anies the problem of tega ant law gw appreciation koq real anies klo upright law is still chaotic in the direction right not go there
244,4p4r4t ikut menang,4p4r4t wins
245,anies selalu jebak asumsi pribadi ada dukung bukti fakta gaco olivia jill biden daesang gempa adidas surabaya batter up 100m views pilih baik melania bangtan debut,anies always trap personal assumptions there is evidence supporting facts gaco olivia jill biden daesang earthquake adidas surabaya batter up 100m views choose well melania bangtan debut
246,ga yang peduli org2 km50 puja riziq soal usah turun suara anies dgn org2 kaya riziq ikut,ga who cares about people2 km50 puja riziq about not going down anies voice with people who are rich in riziq to participate
247,semenjak ngetwit anies followes udah nambah 3000 gimana dong,since tweeting anies followes has added 3000 how about
248,pilpres 2024 tidak pilih subianto pranowo anies baswedan saya tidak golput bingung tah ora kowe,the 2024 presidential election did not choose prabowo subianto odd pranowo anies baswedan I did not golput confused tah ora kowe
249,jgn suuzon bang orang paling ikhlas pak mungkin main cara2 kotor itu pak ikhlas kalo tidak pilih pak ikhlas klo anies pilih tapi kok aku percaya 99 sama statemt abang,jgn suuzon bang the most sincere person pak prabowo may play dirty ways sir prabowo sincere if you don't choose pak prabowo sincere klo anies odd choose but why do I believe 99 same statemt brother
250,anies debat pertama ngomong ngelantur data salah semua,anies the first debate talked about all the wrong data
251,sukasuka orang lah mau milih anies kaga lucu banget dukung anies tukang guilttrip orang liat noh swing voters belum mau ngevote anies awokwok,sukasuka orang lah mau milih anies kaga really funny support anies tukang guilttrip orang liat noh swing voter tidak mau ngevote anies awokwok
252,bukan masalah tapi perlu kaji ulang masih perlu atau tidak capres punya skala prioritas nanti pilih apa dulu mana dulu perlu baik ini anies ikn jadi prioritas masih banyak masalah,not a problem but need to review it still need or not presidential candidates have priority scale then choose what to do first where first need to be good this anies ikn be a priority there are still many problems
253,anies lihat munafik kait sikap lanjut ikn gaco olivia jill biden daesang gempa adidas surabaya batter up 100m views pilih baik melania bangtan debut,anies look hypocritical hook attitude further ikn gaco olivia jill biden daesang earthquake adidas surabaya batter up 100m views choose well melania bangtan debut
254,anies sama jadi seolah2 kerja sama padahal ngalir aja,anies are just as odd as if they were working together even though they just flow
255,link anti rungkad olivia daesang gaco batter up 100m views gempa surabaya anies dana 40 hari first lady pilih baik,link anti rungkad olivia daesang gaco batter up 100m views Surabaya earthquake anies dana 40 days first lady choose well
256,pak anies sdh besar jadi gubernur belimbing sayur besar siapa,mr. anies is already big so who is the governor of big vegetable star fruit
257,moga anies menang amin aamiin amin gaes,let's hope anies wins amen aamiin amen gaes
258,komunikasi ab sangat lancar dengan teuku umar selalu kendala misal kena covid bagai diam tak respons 15 juni 2022 nasdem umum tiga nama calon presiden no 1 anies no 2 andika no 3,"ab communication is very smooth with teuku umar always constraints such as getting covid like odd silent not responding June 15, 2022 general nasdem three names of presidential candidates ganjar no 1 anies no 2 andika no 3"
259,agama islam ajar untuk bakti dua orang tua dinding adidas karina surabaya anies daesang gempa islam,islam teaches for the devotion of two parents adidas wall karina surabaya anies daesang earthquake islam
260,koleksi kendara capres miskin anies baswedan vs capres kaya subianto,a collection of vehicles for poor presidential candidates anies baswedan vs rich presidential candidates prabowo subianto
261,akhir anies kena batu ucap kait udara ber ktp gaco olivia jill biden daesang gempa adidas surabaya batter up 100m views pilih baik melania bangtan debut,end anies hit by stone say air hook with ktp gaco olivia jill biden daesang earthquake adidas surabaya batter up 100m views choose well melania bangtan debut
262,celana panjang chino pria murah kualitas dapat cashback 40 shopee video anies gaco daesang surabaya gempa ayo lihat video shopee video,men's chino trousers cheap quality can cashback 40 shopee video anies prabowo gaco daesang surabaya earthquake let's see video shopee video
263,mantap sih pak anies jauh bangga,"steady, sir, anies is far proud"
264,kata dukung anies cerdas2,words of support for intelligent anies2
265,jelas lebih pantes anies,clearly more pantes anies
266,krn abud anies klaim bangun banyak gereja cek fakta kok sara,krn abud anies claims to build many churches fact check sara
267,serang yang kerja si memed hari buzzer ayah semua medsos debat kpu serang kalap sekali rl nyata ada hasil cenderung negatif anies pelan2 banyak bicara semua kalangantitik cerah,attack the work of the memed day buzzer dad all medsos debate kpu attack once real rl there are prabowo results tend to be negative anies slowly talk a lot all calangantitik sunny
268,bagai warga jakarta kok malah rasa balik yaanies jelas bawa jakarta jauh lebih baik banding gubernur belum,like citizens of jakarta how come even feel back yaanies obviously bring jakarta much better appeal the governor has not
269,panggung debat panggung ny sm anies klo kalah panggung langsung ulti nya pake surat lah lah lah nyari kunci pokok hahahahaaa badut politik,stage debate stage ny odd sm anies klo lose stage directly ultinya use the letter lah lah nyari key staple hahahahaaa political clown
270,uas klo tahu jejak digital anies waktu wawancara dgn najwa shihabselama pak nyapres tdk nyapresdan terang dr ortu masalah mati bocil umur 15thn tdk benar mosok sih uas dukung,uas klo know the digital footprint of anies during interviews with najwa shihab as long as pak prabowo nyapres takdk nyapresdan terang dr ortu the problem of dead children aged 15n tdk benar mosok sih uasukung
271,tinggal dukung anies baswedan lebih mampu ayom rakyat indonesia depan,live prabowo support anies baswedan more able ayom Indonesian people ahead
272,mas daniel mas daniel soal pinang anies jadi gubernur disinggung2 gilir singgung korban nyawa atas kalah mas bowo 2019 kok keluar ucap sampah mau cuci tangan,mas daniel mas daniel about betel anies so the governor was mentioned the death toll for losing mas bowo 2019 why come out saying trash wants to wash their hands
273,singgung soal janji tak maju ada pilpres anies komitmen dki,alludes to the promise of no progress there is a prabowo pilpres anies dki commitment
274,anies memang bisa percaya kata2 nya tukang obral janji,anies can indeed believe the words of the pledge salesman
275,parah banget cantik udah gitu keren dukung pak anies sempurna,"it's so beautiful, it's so cool to support Mr. Anies perfectly"
276,haha janji apa batas hak orang untuk abdi negara emang jamin hak hidup anies baswedan sedih sekali kualitas pikir makin turun,"haha promise what is the limit of people's rights for servants of the country, guarantee the right to life anies baswedan sadly the quality of thought is getting down"
277,fans bole otak pakai nyata jadi hoax hoax kalian buat jadi nyata nonton bnyk,fans bole brains use real so your hoax hoax make it real watch bnyk
